id,created_at,utc_offset,retweet_count,reply_screen_name,source,place_full_name,user_location,hashtags,urls,user_mentions,text,text_clean,hour,ToD,compound,neg,neu,pos
808327605967581184,2016-12-12 15:08:13,-18000.0,0,hrallis,Twitter for iPad,"Minneapolis, MN","Cape Coral, Florida","['TIES16', 'bulbapp', 'shareyoursmarts']",[],['hrallis'],@hrallis So glad you're at #TIES16 Empower Students with simple Digital Portfolios- stop by booth 420 #bulbapp #shareyoursmarts, So glad you're at  Empower Students with simple Digital Portfolios- stop by booth 420  ,15,morning,0.2716,0.126,0.686,0.188
808327611030138880,2016-12-12 15:08:15,-18000.0,0,GoddTill,Twitter Web Client,Canada,"Toronto, ON, CA",[],[],"['GoddTill', 'Leafer1984']","@GoddTill @Leafer1984 It's ""Young Old Coot""","  It's ""Young Old Coot""",15,morning,0.0,0.0,1.0,0.0
808327626922213376,2016-12-12 15:08:18,-18000.0,0,,SafeTweet by TweetMyJOBS,"Minneapolis, MN",,"['job', 'Minneapolis', 'HR', 'Hiring']",['http://bit.ly/2gOGEy7'],[],"Can you recommend anyone for this #job in #Minneapolis, MN? https://t.co/1alj9ZZbq4 #HR #Hiring",Can you recommend anyone for this  in  MN?   ,15,morning,0.3612,0.0,0.737,0.263
808327634329411584,2016-12-12 15:08:20,-18000.0,0,KGerhart1,Twitter for iPad,"Minneapolis, MN","Cape Coral, Florida","['TIES16', 'bulbapp', 'shareyoursmarts']",[],['KGerhart1'],@KGerhart1 So glad you're at #TIES16 Empower Students with simple Digital Portfolios- stop by booth 420 #bulbapp #shareyoursmarts, So glad you're at  Empower Students with simple Digital Portfolios- stop by booth 420  ,15,morning,0.2716,0.126,0.686,0.188
808327666709516288,2016-12-12 15:08:28,-21600.0,0,,Twitter Web Client,"Wisconsin, USA","Madison, WI",[],['http://go.wisc.edu/0my11a'],"['WashCoWisco', 'OzaukeeCounty', 'WI_ETF']","Innovative projects @WashCoWisco @OzaukeeCounty &amp; @WI_ETF to receive 2016 Lloyd D. Gladfelter Awards on Feb 2. 
https://t.co/k4rZLWjWTp","Innovative projects   &amp;  to receive 2016 Lloyd D. Gladfelter Awards on Feb 2. 
",15,morning,0.7096,0.0,0.651,0.349
808327685206409216,2016-12-12 15:08:32,-18000.0,0,jenlegatt,Twitter for iPad,"Minneapolis, MN","Cape Coral, Florida","['TIES16', 'bulbapp', 'shareyoursmarts']",[],['jenlegatt'],@jenlegatt So glad you're at #TIES16 Empower Students with simple Digital Portfolios- stop by booth 420 #bulbapp #shareyoursmarts, So glad you're at  Empower Students with simple Digital Portfolios- stop by booth 420  ,15,morning,0.2716,0.126,0.686,0.188
808327687660048386,2016-12-12 15:08:33,-18000.0,0,,Twitter Web Client,Canada,"Montreal, QC",[],['https://www.youtube.com/watch?v=iIPH8LFYFRk'],[],Good morning https://t.co/qSwnENTCHd,Good morning ,15,morning,0.4404,0.0,0.256,0.744
808327703019425792,2016-12-12 15:08:37,-25200.0,0,,Twitter for iPhone,"St Paul, MN","St Paul, MN",[],[],[],i hope nobody asks me for shit anymore bc that's out the window ?,i hope nobody asks me for shit anymore bc that's out the window ?,15,morning,-0.1779,0.218,0.606,0.176
808327709487222784,2016-12-12 15:08:38,,0,,Twitter for iPhone,"Minneapolis, MN",,['jkNestleownsmylife'],[],[],Going to see Bron &amp; I guess work in the Solon office while I'm there ... #jkNestleownsmylife,Going to see Bron &amp; I guess work in the Solon office while I'm there ... ,15,morning,0.0,0.0,1.0,0.0
808327712599343105,2016-12-12 15:08:39,-32400.0,0,,Twitter Web Client,Canada,,[],[],[],kapoya adto ugma uy,kapoya adto ugma uy,15,morning,0.0,0.0,1.0,0.0
808327712691646468,2016-12-12 15:08:39,-18000.0,0,ctinegrams,Twitter for iPad,"Minneapolis, MN","Cape Coral, Florida","['TIES16', 'bulbapp', 'shareyoursmarts']",[],['ctinegrams'],@ctinegrams So glad you're at #TIES16 Empower Students with simple Digital Portfolios- stop by booth 420 #bulbapp #shareyoursmarts, So glad you're at  Empower Students with simple Digital Portfolios- stop by booth 420  ,15,morning,0.2716,0.126,0.686,0.188
808327744887095296,2016-12-12 15:08:47,-21600.0,0,,Twitter for iPhone,"Wisconsin, USA","Milwaukee, WI",[],['https://twitter.com/keegancalmes/status/808322826163916800'],[],stay hydrated https://t.co/H7aYBk1H7O,stay hydrated ,15,morning,0.0,0.0,1.0,0.0
808327752575254528,2016-12-12 15:08:48,,0,,Twitter for iPhone,"Wisconsin, USA",somewhere,[],[],[],"although you may not realize it, the things you do and the choices you make affect others.","although you may not realize it, the things you do and the choices you make affect others.",15,morning,0.0,0.0,1.0,0.0
808327773735550976,2016-12-12 15:08:53,,0,,Twitter for iPhone,"Minneapolis, MN","Wabasha, MN",['ties16'],[],[],Do it and to heck with outcomes #ties16 Reveals so much about what we think about education and learning!,Do it and to heck with outcomes  Reveals so much about what we think about education and learning!,15,morning,0.0,0.0,1.0,0.0
808327773714608135,2016-12-12 15:08:53,,0,,Twitter for iPhone,"Wisconsin, USA","Minnesota, USA",['intelligencebriefings'],['https://twitter.com/rodeodance/status/808327115384979456'],[],Seriously. WTF?!! #intelligencebriefings https://t.co/0NwvqO9EAz,Seriously. WTF?!!  ,15,morning,-0.3147,0.695,0.305,0.0
808327782635831297,2016-12-12 15:08:56,-21600.0,0,,Twitter for iPhone,"Minnesota, USA",Minneapolis& Cochabamba Boliva,[],[],['AmericanAir'],Please thank @AmericanAir John Sell  at the gate for doing such an awesome job at MSP,Please thank  John Sell  at the gate for doing such an awesome job at MSP,15,morning,0.836,0.0,0.574,0.426
808327787597668352,2016-12-12 15:08:57,-21600.0,0,,Twitter Web Client,"Wisconsin, USA","Madison, WI","['SNPP', 'VIIRS', 'RealEarth', 'UWSSEC', 'UWCIMSS']",['https://realearth.ssec.wisc.edu/s/kkYpN'],[],Hawaii 12/11 PM #SNPP #VIIRS TrueColor (TC) Composite https://t.co/xDpGcOAlb0 #RealEarth™ #UWSSEC #UWCIMSS https://t.co/lDJYixPdkL,Hawaii 12/11 PM   TrueColor (TC) Composite     ,15,morning,0.0,0.0,1.0,0.0
808327801531232256,2016-12-12 15:09:00,-18000.0,0,T_O_dub_D,Twitter Web Client,Canada,"Montreal, QC Canada",[],[],"['T_O_dub_D', 'SnapYourWorld', 'StormHour']",@T_O_dub_D @SnapYourWorld @StormHour BAH! I'll use a snowblower to whisk them down your way,   BAH! I'll use a snowblower to whisk them down your way,15,morning,0.0,0.0,1.0,0.0
808327810230210560,2016-12-12 15:09:02,-18000.0,0,TheHomeworkDog,Twitter for iPad,"Minneapolis, MN","Cape Coral, Florida","['TIES16', 'bulbapp', 'shareyoursmarts']",[],['TheHomeworkDog'],@TheHomeworkDog So glad you're at #TIES16 Empower Students with simple Digital Portfolios- stop by booth 420 #bulbapp #shareyoursmarts, So glad you're at  Empower Students with simple Digital Portfolios- stop by booth 420  ,15,morning,0.2716,0.126,0.686,0.188
808327849702817796,2016-12-12 15:09:12,-18000.0,0,Gin__Gin__Gin,Twitter for Android,"Minneapolis, MN","Minneapolis, MN",[],[],['Gin__Gin__Gin'],"@Gin__Gin__Gin well mentioning his managerial career is a cheap shot too, shall we talk about how klopp almost got dortmund relegated as"," well mentioning his managerial career is a cheap shot too, shall we talk about how klopp almost got dortmund relegated as",15,morning,0.2732,0.0,0.9,0.1
808327881369812992,2016-12-12 15:09:19,,0,,Twitter for iPhone,"St Paul, MN",They/Them ? 17,[],[],[],FUCK I REMEMBERED MY DEVIANTART FROM LIKE 2011,FUCK I REMEMBERED MY DEVIANTART FROM LIKE 2011,15,morning,-0.25,0.34,0.401,0.259
808327886738493440,2016-12-12 15:09:20,-21600.0,0,khurdhorst,Twitter for iPhone,"Minneapolis, MN",,[],[],"['khurdhorst', 'froehlichm', 'kadaniels', '000Dave', 'mrgfactoftheday']",@khurdhorst @froehlichm @kadaniels @000Dave @mrgfactoftheday what if they are 3d printed?,     what if they are 3d printed?,15,morning,0.0,0.0,1.0,0.0
808327892958580736,2016-12-12 15:09:22,-18000.0,0,,Twitter Web Client,Canada,Montreal,[],['http://www.multiculturiosity.com/teriyaki-bbq-unagi-aka-how-to-cook-an-eel/'],[],"Better than sushi = filleting your own eel, marinating it in teriyaki sauce and grilling it. https://t.co/52ZaIYhpC8 https://t.co/V2RJz7rNp4","Better than sushi = filleting your own eel, marinating it in teriyaki sauce and grilling it.  ",15,morning,0.4404,0.0,0.828,0.172
808327953880875008,2016-12-12 15:09:36,,0,,Twitter for iPhone,"Wisconsin, USA",,[],[],[],hurts a little extra today,hurts a little extra today,15,morning,-0.4767,0.508,0.492,0.0
808327977113096194,2016-12-12 15:09:42,,0,Alliniem,Twitter for iPhone,"Wisconsin, USA",,[],[],['Alliniem'],@Alliniem love you sm al??, love you sm al??,15,morning,0.6369,0.0,0.417,0.583
808327977826013185,2016-12-12 15:09:42,-18000.0,0,,TweetMyJOBS,"Fridley, MN","St. Paul, MN","['hiring', 'job', 'Manufacturing', 'Fridley', 'CareerArc']",['http://bit.ly/2hEY5hC'],[],"We're #hiring! Read about our latest #job opening here: General Laborer - https://t.co/XwxHGqFHJN #Manufacturing #Fridley, MN #CareerArc",We're  Read about our latest  opening here: General Laborer -    MN ,15,morning,0.0,0.0,1.0,0.0
808327983203282952,2016-12-12 15:09:43,-18000.0,0,raztech,Twitter for iPad,"Minneapolis, MN","Cape Coral, Florida","['shareyoursmarts', 'digitalportfolios']",[],"['raztech', 'bulbapp']",@raztech Congratulations!!! Much Deserved Award! #shareyoursmarts @bulbapp #digitalportfolios, Congratulations!!! Much Deserved Award!   ,15,morning,0.8614,0.0,0.189,0.811
808328010092974080,2016-12-12 15:09:50,,0,yungIuc,Twitter for iPhone,"Wisconsin, USA","Frogtown, USA",[],[],['yungIuc'],@yungIuc that's a pretty good one, that's a pretty good one,15,morning,0.7269,0.0,0.247,0.753
808328017877602304,2016-12-12 15:09:52,-21600.0,0,,Twitter for iPhone,"Minneapolis, MN",www.KristiBelcamino.com,[],"['http://minnesotawritingworkshop.com', 'https://twitter.com/i/web/status/808328017877602304']",[],Need an agent? Or to polish your writing? I'm teaching Feb 11 at the https://t.co/VJehujyZCy 14 agents &amp; editors at… https://t.co/9OZ6Xl12I5,Need an agent? Or to polish your writing? I'm teaching Feb 11 at the  14 agents &amp; editors at… ,15,morning,0.0,0.0,1.0,0.0
808328035955081218,2016-12-12 15:09:56,-21600.0,0,,iembot,"Wisconsin, USA",,['DLH'],['http://mesonet.agron.iastate.edu/lsr/#DLH/201612121200/201612121200'],[],"At 6:00 AM, 3 NNW Butternut [Ashland Co, WI] CO-OP OBSERVER reports SNOW of 5.80 INCH #DLH https://t.co/CAwrvQMUef","At 6:00 AM, 3 NNW Butternut [Ashland Co, WI] CO-OP OBSERVER reports SNOW of 5.80 INCH  ",15,morning,0.0,0.0,1.0,0.0
808328044712787968,2016-12-12 15:09:58,,0,,Twitter for iPhone,"Minnesota, USA",,[],[],[],Steady subtweeting ab your ex makes you look like a damn fool???,Steady subtweeting ab your ex makes you look like a damn fool???,15,morning,-0.0516,0.19,0.634,0.176
808328065373835264,2016-12-12 15:10:03,-21600.0,0,KillerMartinis,Twitter Web Client,"Minneapolis, MN",Look this link now!,[],[],['KillerMartinis'],. @KillerMartinis Woodrow Wilson centralized government power. The Fed doesn’t just back up banks it gooses the economy = We are doomed.,.  Woodrow Wilson centralized government power. The Fed doesn’t just back up banks it gooses the economy = We are doomed.,15,morning,-0.6369,0.189,0.811,0.0
808340654107414530,2016-12-12 16:00:04,-18000.0,0,,TweetMyJOBS,"Richfield, MN","St. Paul, MN","['job', 'Clerical', 'Richfield', 'Hiring', 'CareerArc']",['http://bit.ly/2fUqwuH'],[],"Can you recommend anyone for this #job? Bond Operations Processor II - https://t.co/58pqfCDSVi #Clerical #Richfield, MN #Hiring #CareerArc",Can you recommend anyone for this  Bond Operations Processor II -    MN  ,16,morning,0.3612,0.0,0.8,0.2
808340681794158593,2016-12-12 16:00:11,-21600.0,0,,Twitter for Android,"Minneapolis, MN","Minneapolis, MN",['DaburaiEssentials'],['https://twitter.com/i/web/status/808340681794158593'],[],You guys wanna see my custom #DaburaiEssentials lightsaber dabstick? It's sooooo sick with two jewels on the tip an… https://t.co/KmIeIGMocT,You guys wanna see my custom  lightsaber dabstick? It's sooooo sick with two jewels on the tip an… ,16,morning,-0.0772,0.148,0.717,0.135
808340721853956096,2016-12-12 16:00:20,-18000.0,0,EllamDon,Twitter Web Client,"Ontario, Canada",Ottawa,[],['https://www.youtube.com/watch?v=LmfVs3WaE9Y'],"['EllamDon', 'zeynep', 'adamjohnsonNYC']","@EllamDon @zeynep @adamjohnsonNYC https://t.co/PYVdxCTfEA A quick check and the NYT would have spotted this as fake, but, hey, ""Whoops!""","    A quick check and the NYT would have spotted this as fake, but, hey, ""Whoops!""",16,morning,-0.3274,0.153,0.847,0.0
808340728988385281,2016-12-12 16:00:22,-21600.0,0,,SafeTweet by TweetMyJOBS,"Bloomington, MN","Headquarters Kansas City, MO",['job'],['https://twitter.com/i/web/status/808340728988385281'],[],Can you recommend anyone for this #job? Project Manager - Environmental Studies and Permitting -… https://t.co/LG5BYTjzho,Can you recommend anyone for this  Project Manager - Environmental Studies and Permitting -… ,16,morning,0.3612,0.0,0.828,0.172
808340731349860352,2016-12-12 16:00:23,-21600.0,0,,Twitter for Android,"Golden Valley, MN",Minnesota,[],['https://twitter.com/EWErickson/status/808334184179793920'],['EWErickson'],Thank you @EWErickson. Spot on. https://t.co/btNzx21EkN,Thank you  Spot on. ,16,morning,0.3612,0.0,0.545,0.455
808340735393034240,2016-12-12 16:00:24,-21600.0,0,,SafeTweet by TweetMyJOBS,"Eagan, MN","Twin Cities, MN","['job', 'SaintPaul', 'Physician', 'Hiring']",['http://bit.ly/2gNKs2C'],[],"Interested in a #job in #SaintPaul, MN? This could be a great fit: https://t.co/SE7tDAvRy1 #Physician #Hiring",Interested in a  in  MN? This could be a great fit:   ,16,morning,0.8519,0.0,0.392,0.608
808340737624514561,2016-12-12 16:00:24,-18000.0,0,cpprima,Twitter Web Client,Canada,"Québec, Canada",[],['https://goo.gl/RVffws'],['cpprima'],@cpprima anticipates gains in operational efficiency and stocking accuracy with the implementation of the XperCount https://t.co/8ERBtfbBdo, anticipates gains in operational efficiency and stocking accuracy with the implementation of the XperCount ,16,morning,0.5994,0.0,0.71,0.29
808340749053874177,2016-12-12 16:00:27,-18000.0,0,,TweetMyJOBS,"Minneapolis, MN","St. Paul, MN","['Minneapolis', 'job', 'Hospitality', 'Hiring', 'CareerArc']",['http://bit.ly/2hF2fpI'],[],"If you're looking for work in #Minneapolis, MN, check out this #job: https://t.co/qeDpPxall3 #Hospitality #Hiring #CareerArc","If you're looking for work in  MN, check out this     ",16,morning,0.0,0.0,1.0,0.0
808340759384641536,2016-12-12 16:00:29,-21600.0,0,makemyheadswim,Twitter for iPhone,"St Paul, MN",Minnesohtah. ,[],[],['crookedxchris'],I should probably tag her. Whoops. @crookedxchris,I should probably tag her. Whoops. ,16,morning,0.0,0.0,1.0,0.0
808340770126200833,2016-12-12 16:00:32,-18000.0,0,Reds12thMan,Twitter for Android,"Minneapolis, MN","Minneapolis, MN",[],[],['Reds12thMan'],"@Reds12thMan yeah, they probably would be in last year's CL too if klopp was fired earlier like Neville was"," yeah, they probably would be in last year's CL too if klopp was fired earlier like Neville was",16,morning,0.0258,0.155,0.644,0.202
808340774127595520,2016-12-12 16:00:33,,0,,Twitter for iPad,"Minnesota, USA","Lakeville, MN",[],[],['laurenhiggins__'],Happy birthday @laurenhiggins__  ?hope you have an amazing day??,Happy birthday   ?hope you have an amazing day??,16,morning,0.8176,0.0,0.444,0.556
808340794209923072,2016-12-12 16:00:38,,0,Rosie909294,Twitter for iPhone,"Wisconsin, USA","Wisconsin, USA",[],[],"['Rosie909294', 'melissallen1212', 'jeremycabo', 'realDonaldTrump']",@Rosie909294 @melissallen1212 @jeremycabo @realDonaldTrump The real threat to the our election was illegals voting. Who knows 1mil 2 mil,    The real threat to the our election was illegals voting. Who knows 1mil 2 mil,16,morning,-0.5267,0.207,0.793,0.0
808340803273846784,2016-12-12 16:00:40,12600.0,0,danielharan,Twitter Web Client,Canada,"Montreal, Canada",[],[],[],"Concurrently, Republicans are now Pro-Russia and anti-Free trade, dismissive of the intel community's findings. 7/","Concurrently, Republicans are now Pro-Russia and anti-Free trade, dismissive of the intel community's findings. 7/",16,morning,0.0,0.0,1.0,0.0
808340804355891204,2016-12-12 16:00:40,-18000.0,0,,Twitter for iPhone,"St Paul, MN","BamaBorn, NCBred, CLT-PHL-MPLS",[],['https://twitter.com/theelectwoman08/status/808310004981841920'],[],My God! And he is defending his statement https://t.co/fezlM6aXIY,My God! And he is defending his statement ,16,morning,0.3382,0.0,0.745,0.255
808340837742604288,2016-12-12 16:00:48,-21600.0,0,WWE_MayaAdler,Twitter for iPhone,"Minneapolis, MN",,[],[],['WWE_MayaAdler'],@WWE_MayaAdler It will never stay up :(, It will never stay up :(,16,morning,0.3412,0.0,0.675,0.325
808340860446380033,2016-12-12 16:00:54,-21600.0,0,classily_yours,Twitter for iPhone,"Wisconsin, USA","Madison, WI",[],[],['classily_yours'],@classily_yours Yes., Yes.,16,morning,0.4019,0.0,0.0,1.0
808340864573566976,2016-12-12 16:00:55,-21600.0,0,WWE_MayaAdler,Twitter for iPhone,"Minneapolis, MN",,[],[],['WWE_MayaAdler'],@WWE_MayaAdler Thank u, Thank u,16,morning,0.3612,0.0,0.0,1.0
808340866096103424,2016-12-12 16:00:55,-21600.0,0,,Twitter Web Client,"Wisconsin, USA","Madison, WI",[],['https://goo.gl/zk76A5'],[],New $10M fund for NE Wisconsin startups!  Read full story here... https://t.co/mj3yq8d8SD,New $10M fund for NE Wisconsin startups!  Read full story here... ,16,morning,0.0,0.0,1.0,0.0
808340913873420295,2016-12-12 16:01:06,-18000.0,0,Juanderooney,Twitter for Android,"Minneapolis, MN","Minneapolis, MN",[],[],['Reds12thMan'],@Reds12thMan I'm not avoiding your question at all tho? I'm saying his point is invalid considering he found himself in a similar position, I'm not avoiding your question at all tho? I'm saying his point is invalid considering he found himself in a similar position,16,morning,0.2584,0.0,0.908,0.092
808340923490902016,2016-12-12 16:01:09,-18000.0,0,Bill_Owen,Twitter Web Client,"Ontario, Canada",Ottawa,['fakenews'],[],"['EllamDon', 'zeynep', 'adamjohnsonNYC']","@EllamDon @zeynep @adamjohnsonNYC Still waiting for a working definition, doesn't have to be 140 chars either. #fakenews","   Still waiting for a working definition, doesn't have to be 140 chars either. ",16,morning,0.0,0.0,1.0,0.0
808340938598842368,2016-12-12 16:01:12,,0,pwschatz,Twitter for iPhone,"St Paul, MN",Saint Paul Minnesota,[],[],['ThisIsMPah'],@ThisIsMPah it's that moment where the fire chief shakes his head and just pulls the firefighters out of the house, it's that moment where the fire chief shakes his head and just pulls the firefighters out of the house,16,morning,-0.34,0.118,0.882,0.0
808340943967547397,2016-12-12 16:01:13,,0,,Twitter Web Client,"Wisconsin, USA",,['TreasonousTrump'],['http://thehill.com/blogs/blog-briefing-room/news/309938-electors-press-for-intelligence-briefing-on-russian'],[],"They should question.   Good.

https://t.co/8c2yN2sydr

#TreasonousTrump","They should question.   Good.

",16,morning,0.4404,0.0,0.508,0.492
808340945997418497,2016-12-12 16:01:14,,0,,Instagram,"Minneapolis, MN","Minneapolis,MN","['Blessed', 'SoberLife']",['https://www.instagram.com/p/BN7Ew-ih4eliBdDQaTdGisDBPgxn33nrLgxfaQ0/'],[],#Blessed??? #SoberLife @ Minneapolis Fire Station 21 https://t.co/TTbQuUKjnL,  @ Minneapolis Fire Station 21 ,16,morning,-0.34,0.444,0.556,0.0
808340965849235456,2016-12-12 16:01:19,-21600.0,0,,Twitter Web Client,"Wisconsin, USA","Downtown Madison, WI",[],['https://twitter.com/i/web/status/808340965849235456'],[],"|| JUST ANNOUNCED ||
Saturday, January 21st @ 8pm
AN EVENING w/ THE SCHWAG
at Majestic Theatre
On Sale 12/16 @ 10am… https://t.co/0J0G8xbDjU","|| JUST ANNOUNCED ||
Saturday, January 21st @ 8pm
AN EVENING w/ THE SCHWAG
at Majestic Theatre
On Sale 12/16 @ 10am… ",16,morning,0.0,0.0,1.0,0.0
808340975282229248,2016-12-12 16:01:21,-21600.0,0,,Twitter Web Client,"St Paul, MN","Saint Paul, MN",[],[],[],"I expect something to crack politically before the 19th.  Don't disappoint me, world.","I expect something to crack politically before the 19th.  Don't disappoint me, world.",16,morning,0.3089,0.0,0.83,0.17
808340982064353280,2016-12-12 16:01:23,-21600.0,0,azizonomics,Twitter Web Client,"Minneapolis, MN",Look this link now!,[],[],"['azizonomics', 'TheLimerickKing', 'bluenosejake']",@azizonomics If it’s unproductive it’s non-self liquidating and won’t meet human needs. @TheLimerickKing @bluenosejake, If it’s unproductive it’s non-self liquidating and won’t meet human needs.  ,16,morning,0.0,0.0,1.0,0.0
808341021650206720,2016-12-12 16:01:32,-21600.0,0,PandaPete21,Twitter Web Client,"Plymouth, MN",,[],[],['PandaPete21'],"@PandaPete21 shameless noobtuber, won't lie.  don't play him cuz i'm good or good at it, play because it's fun to blow shit up"," shameless noobtuber, won't lie.  don't play him cuz i'm good or good at it, play because it's fun to blow shit up",16,morning,0.6842,0.178,0.446,0.376
808341042256748545,2016-12-12 16:01:37,-18000.0,0,,TweetMyJOBS,"St Paul, MN","St. Paul, MN","['hiring', 'job', 'Banking', 'SaintPaul', 'Veterans']",['http://bit.ly/2gZHR2i'],[],"We're #hiring! Read about our latest #job opening here: Personal Banker 1 - https://t.co/qIpK4rrxAY #Banking #SaintPaul, MN #Veterans",We're  Read about our latest  opening here: Personal Banker 1 -    MN ,16,morning,0.0,0.0,1.0,0.0
808341048632053760,2016-12-12 16:01:38,,0,,TweetMyJOBS,"Minneapolis, MN","St. Cloud, MN","['Minneapolis', 'job', 'auto', 'autojobs', 'MNJobs']",['http://bit.ly/2dBQYXk'],[],"See our latest #Minneapolis, MN #job and click to apply: Commercial Store Manager III - https://t.co/WOyniWiH9a #auto #autojobs #MNJobs",See our latest  MN  and click to apply: Commercial Store Manager III -    ,16,morning,0.0,0.0,1.0,0.0
808341046115651584,2016-12-12 16:01:38,,0,laurenduca,Twitter for Android,"Minneapolis, MN","Minneapolis,  MN",[],[],"['laurenduca', 'MichaelPau11', 'tarastrong', 'LauraBenanti', 'DebraMessing', 'StPaulReyburn']",@laurenduca @MichaelPau11 @tarastrong @LauraBenanti @DebraMessing @StPaulReyburn https://t.co/SuH35bQZTP,      ,16,morning,0.0,0.0,0.0,0.0
808341053912838148,2016-12-12 16:01:40,-18000.0,0,,Twitter Web Client,Canada,"Montreal, Quebec",['BlackMirror'],['https://twitter.com/i/web/status/808341053912838148'],['CentaurTheatre'],Urban Tales X: An Undead Xmas (this week at @CentaurTheatre) takes a #BlackMirror approach to Yuletide stories:… https://t.co/hWUUxTDEdm,Urban Tales X: An Undead Xmas (this week at  takes a  approach to Yuletide stories:… ,16,morning,0.0,0.0,1.0,0.0
808341068555157504,2016-12-12 16:01:43,-25200.0,0,nolajohnson1009,Twitter for iPhone,"Minneapolis, MN","Minneapolis, MN",[],[],"['nolajohnson1009', 'galvin_bryan']",@nolajohnson1009 @galvin_bryan can't wait for the wedding. Let me be the wedding planner. Thx.,  can't wait for the wedding. Let me be the wedding planner. Thx.,16,morning,0.3612,0.0,0.815,0.185
808341076528558080,2016-12-12 16:01:45,-21600.0,0,azizonomics,Twitter Web Client,"Minneapolis, MN",Look this link now!,[],[],"['azizonomics', 'TheLimerickKing', 'bluenosejake']",@azizonomics It’s about poverty or not. @TheLimerickKing @bluenosejake, It’s about poverty or not.  ,16,morning,-0.5106,0.452,0.548,0.0
808341112482045953,2016-12-12 16:01:54,,0,beets,Twitter Web Client,Canada,Toronto,[],[],"['beets', 'puptheband']",@beets @puptheband You win!,  You win!,16,morning,0.6239,0.0,0.196,0.804
808341120598081536,2016-12-12 16:01:56,-21600.0,0,,Twitter for iPhone,"St Paul, MN","Minneapolis, MN",[],[],[],So excited for Man in the High Castle season two on Friday ?,So excited for Man in the High Castle season two on Friday ?,16,morning,0.4005,0.0,0.803,0.197
808341134711947270,2016-12-12 16:01:59,,0,,Twitter for iPhone,"Minneapolis, MN",,[],[],[],I'm a chocolate covered strawberries &amp; red roses type of girl ??,I'm a chocolate covered strawberries &amp; red roses type of girl ??,16,morning,0.0,0.0,1.0,0.0
808341158405541889,2016-12-12 16:02:05,-21600.0,0,Spotify,Twitter for iPhone,"Minneapolis, MN",,[],[],['Spotify'],@Spotify resend my year in music to my email, resend my year in music to my email,16,morning,0.0,0.0,1.0,0.0
808341163333865473,2016-12-12 16:02:06,,0,,Twitter for iPhone,"St Paul, MN",Aigues-Mortes,[],['https://twitter.com/energydesk/status/808322328430047232'],[],I'm about to cry ??? just another way trump's administration is going to ruin this world https://t.co/4lpgyZUeuZ,I'm about to cry ??? just another way trump's administration is going to ruin this world ,16,morning,-0.7845,0.33,0.67,0.0
808341186062745600,2016-12-12 16:02:11,,0,,Twitter Web Client,Canada,Canada,[],[],[],if $AKAO can break 9.15 it will run,if $AKAO can break 9.15 it will run,16,morning,0.0,0.0,1.0,0.0
808341190898753536,2016-12-12 16:02:12,12600.0,0,danielharan,Twitter Web Client,Canada,"Montreal, Canada",[],[],[],"Anyways, I've never read much dystopian fiction but maybe I need to do so now to help me understand WTF is happening. 8--/","Anyways, I've never read much dystopian fiction but maybe I need to do so now to help me understand WTF is happening. 8--/",16,morning,-0.5194,0.208,0.661,0.13
808341192383594496,2016-12-12 16:02:13,-25200.0,0,,Twitter for iPhone,"Bloomington, MN",,[],[],[],It's cold as f**k right now. My nipples harder than most of yall mixtapes ?,It's cold as f**k right now. My nipples harder than most of yall mixtapes ?,16,morning,0.0,0.0,1.0,0.0
808341230190927873,2016-12-12 16:02:22,-18000.0,0,,TweetMyJOBS,"Minnesota, USA","St. Paul, MN","['hiring', 'Job', 'SaintPaul', 'Veterans', 'Jobs', 'CareerArc']",['http://bit.ly/2gq70qw'],[],"We're #hiring! Click to apply: Specialty Sales-Frivolous - https://t.co/H9dhigq6hL #Job #SaintPaul, MN #Veterans #Jobs #CareerArc",We're  Click to apply: Specialty Sales-Frivolous -    MN   ,16,morning,0.0,0.0,1.0,0.0
